{
  "$schema": "https://json-schema.org/draft/2020-12/schema",
  "$id": "https://github.com/BryceWDesign/IX-StellaratorForge/schemas/reactor/sfr5_reality_gradient.schema.json",
  "title": "SFR-5 Reality Gradient and Adaptive Inverse Design",
  "type": "object",
  "additionalProperties": false,
  "required": [
    "schema_version",
    "study_id",
    "source_release",
    "source_artifacts",
    "constraint_pressure",
    "search_policy",
    "movable_design_variables",
    "required_external_methods",
    "reopen_conditions",
    "promotion_status",
    "claim_boundary"
  ],
  "properties": {
    "schema_version": {"const": "0.10.0"},
    "study_id": {"const": "SFR5-REALITY-GRADIENT-A"},
    "source_release": {"const": "0.9.0"},
    "source_artifacts": {
      "type": "object",
      "required": ["sfr4_result", "sfr4_config"],
      "properties": {
        "sfr4_result": {"type": "string", "minLength": 1},
        "sfr4_config": {"type": "string", "minLength": 1}
      }
    },
    "constraint_pressure": {
      "type": "object",
      "required": ["rho", "normalization", "uncertainty_policy"],
      "properties": {
        "rho": {"type": "number", "exclusiveMinimum": 0},
        "normalization": {"type": "string", "minLength": 1},
        "uncertainty_policy": {"type": "string", "minLength": 1}
      }
    },
    "search_policy": {
      "type": "object",
      "required": ["stagnation_window", "minimum_relative_improvement", "forbid_bruteforce_same_family_after_rejection", "candidate_families"],
      "properties": {
        "stagnation_window": {"type": "integer", "minimum": 2},
        "minimum_relative_improvement": {"type": "number", "minimum": 0, "maximum": 1},
        "forbid_bruteforce_same_family_after_rejection": {"const": true},
        "candidate_families": {"type": "array", "minItems": 3, "uniqueItems": true, "items": {"type": "string", "minLength": 1}}
      }
    },
    "movable_design_variables": {"type": "array", "minItems": 4, "items": {"type": "object"}},
    "required_external_methods": {"type": "array", "minItems": 4, "items": {"type": "object"}},
    "reopen_conditions": {"type": "array", "minItems": 1, "uniqueItems": true, "items": {"type": "string", "minLength": 1}},
    "promotion_status": {"type": "object", "minProperties": 2},
    "claim_boundary": {
      "type": "object",
      "minProperties": 1,
      "additionalProperties": {"const": 0.0}
    }
  }
}
